{
    "description": "The problem: min{2x + sin(x)^2 + y}.",
    "version": 0,
    "variables": [{
        "name": "x"
    }, {
        "name": "y"
    }],
    "objectives": [{
        "sense": "min",
        "function": {
            "head": "Nonlinear",
            "root": {
                "head": "node",
                "index": 4
            },
            "node_list": [{
                "head": "*",
                "args": [{
                    "head": "real",
                    "value": 2
                }, {
                    "head": "variable",
                    "name": "x"
                }]
            }, {
                "head": "sin",
                "args": [{
                    "head": "variable",
                    "name": "x"
                }]
            }, {
                "head": "^",
                "args": [{
                    "head": "node",
                    "index": 2
                }, {
                    "head": "real",
                    "value": 2
                }]
            }, {
                "head": "+",
                "args": [{
                    "head": "node",
                    "index": 1
                }, {
                    "head": "node",
                    "index": 3
                }, {
                    "head": "variable",
                    "name": "y"
                }]
            }]
        }
    }],
    "constraints": []
}